Author,Co-authors
Soufiane Bahou,"H. Ez‐zahraouy, H. Labrim, M. Lakhal, B. Hartiti, M. Bhihi"
I. Ourya,"S. Abderafi, Nouhaila Nabil, N. Boutammachte, S. Rachidi"
Nouhaila Nabil,"S. Rachidi, N. Lahboubi, A. Alaoui-Belghiti, Hassan El Bari, Sanae Habchi, I. Ourya, Seddiq Sebbahi, Oussama Bayssi, N. Boutammachte, A. Hajjaji, S. Abderafi, R. Villa, S. Laasri, Yasna Mortezaei"
S. Rachidi,"M. Asbik, Nouhaila Nabil, K. E. Alami, N. Zari, A. Amrani, B. Mitchell, C. Fausser, Dominique Pelca, H. Ait Ousaleh, Yousra Filali Baba, Abdechafik Elharrak, Yassine Nassereddine, H. Bouzekri, P. Flaud, J. Merckx, A. Faik, B. Mauroy, H. Agalit, Samir Touili, M. Boudi"
M. Mahdavi,"K. Schmitt, H. Shayeghi, R. Romero, Hassan Haes Alhelou, Manohar Chamana, F. Jurado, Augustine Awaafo, H. Monsef, A. Bagheri, S. Jalilzadeh, F. Jurado, P. Siano, Stephen B. Bayne, J. Catalão, A. Kimiyaghalam, M. Javadi, A. Kazemi, D. Vera, R. Ramos, Leonardo H. Macedo"
D. Vera,"F. Jurado, D. A. López-García, L. Fernández-Lobato, B. Ruiz-Carrasco, Manuel Sánchez-Raya, J. Montesdeoca, M. Tostado‐Véliz, Y. López-Sánchez, P. Xu, Mohamed H. Hassan, Hoda Abd El-Sattar, Víctor Hugo del Corral, M. Castro, Antonio Escámez, Daniel Sánchez-Lozano, Roque Aguado, J. P. Torreglosa, Salah Kamel, Juan Pérez Torreglosa, M. Tostado-V éliz"
L. Sadek,"H. Talibi Alaoui, H. Alaoui, E. Sadek, A. Bataineh, A. Bentbib, I. Hashim, Tania A. Lazăr, Ishak Hashim, O. Isik, K. Shah, O. Sadek, Mohammed S. Abdo, A. Sami Bataineh, A. Akgül, Bouchra Abouzaid, Said Ounamane, B. Abouzaid, T. Abdeljawad"
O. Sadek,"S. Touhtouh, A. Hajjaji, M. Rkhis, M. El Jouad, F. Belhora, L. Sadek, R. Anoua, K. Shah, M. Bejar, E. Dhahri, Mohammed S. Abdo, El Mahdi Bouabdalli, El Mahdi Bouabdalli, Aymane Dahbi, L. Sadek, M. Khlifi, T. Abdeljawad, E. Hlil, Marwan Abdou Ahmed, H. Talibi Alaoui"
T. Abdeljawad,"K. Shah, F. Jarad, Aziz Khan, Manar A. Alqudah, D. Baleanu, K. Nisar, Bahaaeldin Abdalla, P. Mohammed, G. Rahman, Mohammed S Abdo, H. Khan, Kamal Shah, M. Sarwar, J. Alzabut, Q. Al‐Mdallal, Nabil Mlaiki, Nabil Mlaiki, I. Mahariq, M. Samraiz, Aziz Khan"
Sara El Hassani,"A. Mezrhab, M. Moussaoui, M. Charai, Othmane Horma, Aboubakr El hammouti, Y. Admi, D. Santana, J. Benhamou, S. Channouf, Mohammed Amine Moussaoui, Ouassila selhi, Hanane Miri, Mugur Balan, T. Kousksou, F. Oueslati, S. Derfoufi"
F. Oueslati,"B. Ben-Beya, T. Lili, Salwa Fezai, N. Ben-Cheikh, H. Beji, A. Belghith, Fezai Salwa, D. Santana, Othmane Horma, Sara El Hassani, M. Moussaoui, B. B. Beya, A. Mezrhab"
A. Mezrhab,"M. Moussaoui, S. Amraqui, M. Charai, Benyounes Raillani, H. Naji, M. Jami, M. Karkri, Dounia Chaatouf, M. Salhi, J. Benhamou, M. Bouzidi, Y. Admi, F. Moufekkir, S. Channouf, H. Sghiouri, El Bachir Lahmer, A. A. Merrouni, Othmane Horma, A. Bria, N. Dihmani"
I. Ourya,"S. Abderafi, Nouhaila Nabil, N. Boutammachte, S. Rachidi"
S. Abderafi,"T. Bounahmidi, S. Vaudreuil, Mohamed Anouar Kamzon, Ahmed Tgarguifa, A. Brahim, Ahmed Bichri, Jaouad Eddouibi, Yousra Jbari, I. Ndiaye, S. Aboudaoud, M. Chaanaoui, A. Rich, J. Klein, Fayrouz El hamdani, Samya Sigue, A. Brahmi, I. Ourya, D. Mangin, S. Vaudreuil, I. Chaoui"
Hamza El Hafdaoui,"A. Khallaayoun, K. Ouazzani, Faissal Jelti, A. Jamil, Hamza El Alaoui, Ibtissam Bouarfa, Ahmed Bazzi, A. Khaldoun, M. El Ydrissi, Kedar Mehta, Anas Temouden, Salma Mahidat, Zakaria El Harmouzi, Mohamed Boujoudar, Abdelmajid Jamil, Hamza Touhs, Dalal Nasreddin, Aya Boumelha, Khadija Ajabboune, Soukaina Jaafari"
A. Khallaayoun,"Hamza El Hafdaoui, R. Lghoul, K. Ouazzani, Yikun Huang, Faissal Jelti, Imane L'hadi, A. Jamil, Reda El Makroum, Kedar Mehta, Hamza El Alaoui, Hamza El Hafdaoui, D. Benhaddou, Ahmed Bazzi, Sarah Lahtani, Mohammed Bakr Sikal, Konstantina Mentesidi, Mhammed Chraibi, M. Abid, A. Olson, W. Zörner"
K. Ouazzani,"M. Benslimane, Hamza El Hafdaoui, Mehdi Tmimi, A. Khallaayoun, M. Berrada, A. Jamil, J. Bentama, Ouissal Drissi El Bouzaidi, A. Allouhi, Faissal Jelti, A. A. Mana, A. Khaldoun, A. Elgarouani, P. Schmitz, A. El-Imache, M. Ayadi, A. Mana, Kedar Mehta, Ibtissam Bouarfa, Ahmed Bazzi"
Daniel Sánchez-Lozano,"M. Tostado‐Véliz, Antonio Escámez, F. Jurado, Roque Aguado, Paul Arévalo, L. I. Minchala-Ávila, D. Vera, D. Benavides, D. Vera, Adrián Criollo, A. Ghadimi, M. Miveh, R. Hadria, S. Oulbi"
Antonio Escámez,"M. Tostado‐Véliz, D. Vera, F. Jurado, Daniel Sánchez-Lozano, R. Aguado, F. Jurado, Roque Aguado, Paul Arévalo, F. Jurado, S. Mansouri, J. Aguado, D. Benavides, D. Vera, Yahya Z. Alharthi, A. Ghadimi, A. Rezaee Jordehi, M. Miveh, R. Hadria, S. Kamel, S. Oulbi"
D. Vera,"F. Jurado, F. Jurado, S. Kamel, R. Aguado, J. P. Torreglosa, M. Ortega, Antonio Escámez, H. A. El-Sattar, M. Tostado‐Véliz, D. A. López-García, M. Ortega, F. Jurado, M. Mahdavi, B. D. Mena, J. Carpio, M. Tawfik, L. Fernández-Lobato, Hend Dakhel Alhassany, Safaa Malik Abbas, Roque Aguado"
Samir Idrissi Kaitouni,"Mohamed Oualid Mghazli, Jamal Brigui, Niima Es-sakali, Mohammed Ahachad, J. Brigui, F. El Mansouri, Ibtihal Ait Abdelmoula, Imad Ait Laasri, Moha Cherkaoui, Jens Pfafferott, Mohamed El Mankibi, Abdelmajid Jamil, M. Ahachad, M. Charai, J. Pfafferott, A. Jamil, Park Sangkyu, Mohamed Oualid Mghazli, Zineb Zoubir, Abdellah Nait-Taour"
Mohamed Oualid Mghazli,"Niima Es-sakali, Samir Idrissi Kaitouni, Imad Ait Laasri, Moha Cherkaoui, S. I. Kaitouni, M. Charai, Imad Ait Laasri, Abdellah Nait-Taour, Abdelkader Outzourhit, Jens Pfafferott, Mohamed El Mankibi, Abdelmajid Jamil, A. Outzourhit, J. Pfafferott, Imane Bouchefra, Fatima-Zahra El-Bichri, Mohammed Ahachad, Jamal Brigui, I. Sobhy, S. Cherif"
J. Brigui,"F. Cacciola, F. Mansouri, M. Palma, M. P. Lovillo, A. Liazid, C. Barroso, L. Mondello, H. E. Cadi, F. El Mansouri, G. F. Barbero, Asmae El Cadi, H. E. Farissi, Yassine Oulad El Majdoub, B. Ramdan, R. Rodríguez-Barroso, J. E. D. Esteves da Silva, J. C. D. Silva, A. Sakali, J. M. Quiroga, Ginane Selama"
F. Z. Echogdali,"S. Boutaleb, M. Abioui, M. Ouchchen, K. Abdelrahman, M. Ikirri, M. Id-Belqas, T. Abu-Alam, B. Dadi, H. El Ayady, M. Fnais, E. Abia, A. Bendarma, F. Faik, K. Mickus, R. B. Kpan, S. Essoussi, K. S. Sajinkumar, A. Miftah, M. Aadraoui, J. Aswathi"
S. Boutaleb,"M. Abioui, F. Z. Echogdali, L. Bouchaou, T. Tagma, M. Ouchchen, K. Abdelrahman, M. Ikirri, Y. Hsissou, M. Id-Belqas, N. Ettayfi, F. Ain-Lhout, M. Zunzunegui, B. Dadi, A. Vengosh, M. Fnais, E. Abia, Z. Lgourna, L. Bouragba, T. Abu-Alam, J. Jáuregui"
K. S. Sajinkumar,"T. Oommen, V. Rani, A. Rajaneesh, K. P. Thrivikramji, C. Vishnu, E. Bouali, C. Muraleedharan, S. Keerthy, P. Sundarajan, J. Aswathi, A. P. Pradeepkumar, S. Anbazhagan, Y. Anilkumar, R. Samuel, H. S. Bincy, Thomas Oommen, T. Martha, J. Gierke, Sidike Paheding, R. S. Ajin"
Mohamed Gouraizim,"A. Makan, Hossain El Ouarghi, A. Fadili"
A. Makan,"A. Fadili, K. Mehdi, Saliha Najib, M. Mountadar, J. Riss, A. Hasnaoui, A. Hassani, O. Assobhei, K. Sbiaai, A. Tabyaoui, Othmane Boualla, Fatima Benyoucef, B. Zourarah, D. Malamis, M. Loizidou, P. Malaurent, A. E. Ghmari, M. Saddik, Nadia Haouari, Khadija Boutayeb"
Hossain El Ouarghi,"Said Benyoussef, Yassine El Yousfi, Asmae Charki, M. Ahari, Mourad Aqnouy, Hicham Gueddari, Abdennabi Alitane, M. Himi, Ali Ait Boughrous, Hanane Ait Hmeid, Nouhaila Hadoudi, H. Amhamdi, N. Nouayti, M. A. Aboulhassan, Mourad Arabi, Abdelhak Bourjila, Maryam Azirar, Fatiha Mchiouer, Mohamed Chahban, Abdallah Elaaraj"
O. Jbaihi,"A. Ghennioui, Fatima-zahra Ouchani, M. Maaroufi, A. A. Merrouni, Ahmed Alami Merrouni, M. Cherkaoui, G. Tazi, M. Bakkali"
Fatima-zahra Ouchani,"O. Jbaihi, M. Maaroufi, A. Ghennioui, Ahmed Alami Merrouni, M. Cherkaoui, A. A. Merrouni, Reda Boualou, Khadija El Alami, E. Bennouna, S. Rachidi, M. Asbik, H. Agalit"
M. Maaroufi,"M. Ouassaid, O. Jbaihi, Fatima-zahra Ouchani, A. Ghennioui, N. Zari, M. Cherkaoui, A. Yahfdhou, Y. Errami, Kawtar Benabdelaziz, H. Agalit, A. Agoumi, L. Stour, I. A. Ethmane, Imane El Karaoui, Ahmed Alami Merrouni, B. Lebrouhi, Lhoussaine Oubrich, Y. Jemmal, A. Mahmoud, B. Bossoufi"
Mustapha Salihi,"Y. Chhiti, Yasser Harmen, C. Jama, Maryam El Fiti, Ahmed Chebak, Fatima Ezzahrae M’hamdi Alaoui, M. Achak, Srhir Bousalham, F. Bentiss, A. Azouzoute, Massaab El Ydrissi, Zakaria Elmaazouzi, M. Benhaddou, M. El Ydrissi, Omaima El Alani, Mounir Abraim, Mounia Achak, Maryam El Fiti, H. Ghennioui, M. Garoum"
Maryam El Fiti,"Y. Chhiti, Yasser Harmen, Mustapha Salihi, C. Jama, Fatima Ezzahrae M’hamdi Alaoui, Ahmed Chebak, M. Achak, F. Bentiss, Srhir Bousalham, Mounia Achak"
C. Jama,"F. Bentiss, N. Chihib, A. Zarrouk, Y. Chhiti, B. Sabour, A. Reani, P. Goudmand, O. Dessaux, S. Duquesne, Z. Belattmania, M. Traisnel, S. Khelissa, B. Hammouti, R. Delobel, L. Gengembre, M. Lebrini, S. Bourbigot, M. Abdallah, I. Warad, M. Tourabi"
F. Z. Echogdali,"S. Boutaleb, M. Abioui, M. Ouchchen, K. Abdelrahman, M. Ikirri, M. Id-Belqas, T. Abu-Alam, B. Dadi, H. El Ayady, M. Fnais, E. Abia, A. Bendarma, F. Faik, K. Mickus, R. B. Kpan, S. Essoussi, K. S. Sajinkumar, A. Miftah, M. Aadraoui, J. Aswathi"
S. Boutaleb,"M. Abioui, F. Z. Echogdali, L. Bouchaou, T. Tagma, M. Ouchchen, K. Abdelrahman, M. Ikirri, Y. Hsissou, M. Id-Belqas, N. Ettayfi, F. Ain-Lhout, M. Zunzunegui, B. Dadi, A. Vengosh, M. Fnais, E. Abia, Z. Lgourna, L. Bouragba, T. Abu-Alam, J. Jáuregui"
K. S. Sajinkumar,"K. Abdelrahman, M. Abioui, J. Danumah, A. Rajaneesh, M. Fnais, R. S. Ajin, F. Z. Echogdali, Alfred Johny, T. Oommen, S. Boutaleb, S. Saha, P. C. Mammen, R. Costache, A. Bendarma, K. P. Thrivikramji, M. Ouchchen, V. Rani, C. Vishnu, S. Prasood, Chandini P. C. Senan"
Oujda Morocco,"A. Aziz, H. Barebita, M. F. Lestari, T. Guedira, A. Syoufian, M. Taleb, A. Budiman, T. Rachidi, S. Zouggar, A. I. Agipa, A. M. Wahba, Amira Metouekel, Abdelfattah Abdellaoui, A. A. Elbaz, K. Wijaya, Aziza Fitat, Y. Taidi, Fatima Zafra Bousseraf, EL Belkacem, El Boulifi"
Naglaa Abdou,"W. Abd-Allah, N. El-Faramawy, Huda A. Alazab, M. Farag, S. Hamdaoui, Amany Y Shahein, N. Zorba, Y. El Mghouchi, A. Hajou, K. Jraida, A. Sadek, H. Abed, H. Saudi, H. S. Hafez, M. Sabry, M. Mouqallid"
Y. El Mghouchi,"S. Hamdaoui, E. Chham, Anas Hajou, Mohamed Chaoui, A. Hajou, E. Zemmouri, K. Jraida, A. El bouardi, Naglaa Abdou, M. Mouqallid"
M. Mouqallid,"E. Affad, R. Amraoui, H. E. Mghari, B. Lecordier, M. Obounou, A. A. Msaad, M. Trinite, D. Garréton, L. Souinida, S. Vottier, Z. Ihsane, S. Hamdaoui, D. Allano, Y. El Mghouchi, M. Kaddiri, A. Hajou, K. Jraida, M. Mahdaoui, Naglaa Abdou, E. Rouland"
M. Sedrati,"E. Anthony, E. Ariffin, M. Akhir, Rosnan Yaacob, M. Husain, D. Menier, I. Aouiche, M. Mathew, E. Goubert, E. G. Pintado, L. Daoudi, D. Jackson, A. Cooper, Klervi Hamon-Kerivel, J. Morales, E. Ziane, O. Morio, A. Beltifa, J. Morales, Hedi Ben Mansour"
J. Morales,"J. Borrego, M. Sedrati, A. R. Ramírez, R. Díaz-Delgado, I. Díaz-Martínez, E. Mayoral, J. Duveau, B. Carro, A. Rodríguez-Ramírez, J. Grande, J. G. Pendón, Ana Santos, L. Morales, E. Anthony, R. L. Gall, A. Gómez‐Olivencia, A. Pérez-Alberti, J. Rivera-Silva, J. Gutiérrez-Mas, C. Juan"
Abdelkarim Tadibaght,"A. E. M'rini, O. Bellier, L. Siame, M. Sedrati, E. Anthony, R. L. Gall, Ali Bounab, Kamal Agharroud, Y. El Kharim, Abdelmounim El M’rini, Otman El Ouaty, Glen Bulot, J. Morales"
M. Kharrich,"S. Kamel, M. Akherraz, O. Mohammed, M. Akherraz, Y. Sayouti, M. Abdel-Akher, A. Eid, M. I. Mosaad, R. Ellaia, A. Selim, A. Alghamdi, Mohamed H. Hassan, Jonghoon Kim, Mohamed Abdeen, Chaymae Fahassa, S. Elsayed, M. Tostado‐Véliz, F. Jurado, Ibrahim B. M. Taha, E. Elattar"
S. Kamel,"F. Jurado, Mohamed Ebeed, A. Selim, Mohamed H. Hassan, M. Tostado‐Véliz, M. Bajaj, L. Nasrat, Juan Yu, Ahmed Korashy, Hamdy M. Sultan, Abdel‐Raheem Youssef, Hossam M. Zawbaa, H. Abdel-Mawgoud, Ahmed S. Menesy, A. Rashad, M. Abdel-Akher, Mohamed Khamies, H. A. El-Sattar, B. Khan, M. Khasanov"
S. Rhee,"Kyu-Ho Kim, Chang-Hwan Kim, A. Wadood, Tahir Khurshaid, Chul-Hwan Kim, Saeid Gholami Farkoush, H. Seo, Jiang-tao Yu, Soobae Kim, B. Kwon, K. Song, Seung-Ryle Oh, Jae-Chul Kim, K. Hwang, O. Hyun, Seok-Ku You, Byoung-yull Yang, Saeid Gholami Farkoush, Sang-keun Lee, S. Kamel"
Mounir Abraim,"H. Ghennioui, A. Ghennioui, Omaima El Alani, A. Azouzoute, M. El Ydrissi, N. Hanrieder, Mohamed Boujoudar, S. Wilbert, Massaab El Ydrissi, Omaima El Alani, Azouzoute Alae, Y. Saint-Drenan, Ayoub Oufadel, Fatima-ezzahra Dahr, Mustapha Salihi, Hicham El Gallassi, Ilyass Ikenbi, Ibrahim Taabane, P. Blanc, E. Bennouna"
Mustapha Salihi,"Y. Chhiti, Yasser Harmen, C. Jama, Maryam El Fiti, Ahmed Chebak, Fatima Ezzahrae M’hamdi Alaoui, M. Achak, Srhir Bousalham, F. Bentiss, A. Azouzoute, Massaab El Ydrissi, Zakaria Elmaazouzi, M. Benhaddou, M. El Ydrissi, Omaima El Alani, Mounir Abraim, Mounia Achak, Maryam El Fiti, H. Ghennioui, M. Garoum"
A. Azouzoute,"A. Ghennioui, M. Garoum, A. A. Merrouni, E. Bennouna, C. Hajjaj, Massaab El Ydrissi, M. El Ydrissi, Omaima El Alani, Mounir Abraim, Houssain Zitouni, Samir Touili, A. Amrani, Ayoub Oufadel, H. Ghennioui, M. Benhaddou, Y. El hassouani, Mustapha Salihi, Mohamed Boujoudar, N. Hanrieder, F. Jeffali"
H. Krabch,"R. Tadili, A. Idrissi, I. Ihoume, N. Arbaoui, M. Benchrifa, M. Daoudi, M. Bargach, H. Essalhi"
R. Tadili,"M. Bargach, M. Benchrifa, H. Essalhi, I. Ihoume, N. Arbaoui, A. Dahman, A. Idrissi, H. Krabch, A. Mechaqrane, H. Samrani, A. Khyad, B. Ihya, J. Mabrouki, A. Ourhedja, M. Daoudi, A. Bernatchou, M. Boukallouch, H. Loutfi, A. Mcheqrane, A. Idrissi"
A. Idrissi,"I. Ihoume, N. Arbaoui, R. Tadili, M. Benchrifa, H. Krabch, C. Tajani, M. Daoudi, A. Ait Sidi Mou, M. Daoudi, Hana Fakhouri, A. I. Idriss, M. Bargach, N. A. Arreyndip, M. Sabbane, Imad Krkri, M. Sabbane, H. Essalhi, Mohamed Benchrifa"
Hassan Ait Naceur,"B. Igmoullan, Ahmed Abdullah Al Dughairi, Motrih Al-Mutiry, Hussein Almohamad, M. Namous, H. Abdo"
H. Abdo,"Hussein Almohamad, Ahmed Abdullah Al Dughairi, Motrih Al-Mutiry, K. Alsafadi, S. Mohammed, M. Al-Mutiry, Ahmed Abdullah Al Dughairi, S. Karuppannan, J. Rodrigo‐Comino, S. Hussain, A. Mokhtar, M. Mubeen, A. Elbeltagi, W. Nasim, S. Saravanan, NagireddyMasthan Reddy, Md. Mostafizur Rahman, Mona Alrasheedi, Ahmed Abdullah Al Dughairi, Al Dughairi"
Motrih Al-Mutiry,"Hussein Almohamad, H. Abdo, Ahmed Abdullah Al Dughairi, S. Karuppannan, Md. Mostafizur Rahman, Ali Masria, R. Costache, A. Benmohammadi, Ahmed Abdullah Al Dughairi, K. Alsafadi, A. Islam, Gajendra Singh, S. Mohammed, Naveen Chandra, Arvind Pandey, Mona Alrasheedi, Ahmed Abdullah Al Dughairi, Zhour Ennouali, Youssef Fannassi, Hazam Ghassan Abdo"
M. Boulakhbar,"T. Kousksou, M. Zazi, M. Maaroufi, Kawtar Benabdelaziz, Markos Farag, A. Jamil, B. Lebrouhi, S. Smouh, Farag Markos"
Markos Farag,"M. Boulakhbar, T. Kousksou, Kawtar Benabdelaziz, Chahir Zaki, M. Zazi, Ephraim A Ogbonna, M. Maaroufi, Boulakhbar Mouaad, Benabdelaziz Kawtar, Olalekan J. Akintande, Olusanya E. Olubusoye, Zazi Malika, Kousksou Tarik, O. Yaya"
M. Zazi,"Youssef Barradi, N. Khaldi, K. Zazi, El Mehdi Laadissi, Ihssane Chtouki, Marouane Rayyam, Anas El Filali, H. Mahmoudi, Azeddine Loulijat, Mohamed Makhad, P. Wira, M. Boulakhbar, T. Kousksou, N. Elalami, M. Maaroufi, Kawtar Benabdelaziz, E. Anas, Bruno Collicchio, M. Mansori, Markos Farag"
Samir Touili,"A. Amrani, Ahmed Alami Merrouni, A. A. Merrouni, Y. El hassouani, A. Azouzoute, Y. Hassouani, Hassane Dekhissi, Salah-eddine Amrani, S. Rachidi, H. Ait Lahoussine Ouali, H. A. L. Ouali, M. Soomro, Mahmoud Eltaweel, Mounia Bentahila, Mujeeb IQBAL SOOMRO, Ibrahim Moukhtar, Hanae Ait Lahoussine Ouali, E. Bennouna, A. Ghennioui, A. El Amrani"
Abdellatif Bouaichi,"A. Ghennioui, C. Hajjaj, C. Messaoudi, Houssain Zitouni, A. A. Merrouni, B. Ikken, A. Amrani, A. El Amrani, Ahmed Alami Merrouni, M. Benhmida, M. Regragui, S. Sahnoun, A. Benlarabi, Z. Naimi, P. Logerais, Massaab El Ydrissi, Aboubakr Benazzouz, A. Amrani, Abdellah El Hassani, Mahamadou Abdou Tankari"
C. Messaoudi,"A. Amrani, A. El Amrani, M. Halimi, Abdellatif Bouaichi, Malika Ouhadou, Mohamed Hajjaj, Imane Outana, A. Ghennioui, C. Hajjaj, J. Diouri, A. Bouaaddi, A. A. Merrouni, Said Ziani, B. Ikken, Z. Naimi, G. Abdellatif, Bouaichi Abdellatif, A. Amrani, Amparo C. Abel-Bey, Zenobia Brown"
H. Ait Lahoussine Ouali,"Ahmed Alami Merrouni, M. Moussaoui, A. Mezrhab, R. Guechchati, Samir Touili, Sittiporn Channumsin, Latifa El Boujdaini, Shahariar Chowdhury, Mujeeb IQBAL SOOMRO, Ibrahim Moukhtar, A. Khouya, N. Ullah, K. Techato, A. A. Merrouni, A. Mezrhab"
Ahmed Alami Merrouni,"A. Amrani, Samir Touili, A. Ghennioui, Maryam Mehdi, Nabil Ammari, Y. El hassouani, Aboubakr Benazzouz, E. Chaabelasri, H. Ait Lahoussine Ouali, M. Dahmani, Jamal-Eddine Salhi, Hicham El Gallassi, Ali Lamrani Alaoui, Salah-eddine Amrani, Abdellatif Bouaichi, O. Jbaihi, Fatima-zahra Ouchani, M. Maaroufi, Abdelkarim Daoudia, Hassane Dekhissi"
N. Ullah,"K. Techato, Y. Belkhier, A. Alahmadi, Md. Shahariar Chowdhury, I. Sami, A. Ibeas, Shaoping Wang, A. Khattak, G. Abbas, A. Achour, R. Shaw, H. Alkhammash, Wakeel Khan, J. Herrera, J. Aslam, Naveed Ashraf, J. Ro, M. I. Khattak, A. Ulasyar, M. Shafi"
S. Smouh,"A. Jamil, F. Gargab, T. Kousksou, B. Ouhammou, M. Maaroufi, B. Lebrouhi, M. Boulakhbar, Abdel Ali Mana, Samir El idrissi kaitouni, Rachid El mrabet, M. Aggour, R. Saadani, M. Zazi"
F. Gargab,"A. Jamil, T. Kousksou, B. Ouhammou, A. Benbassou, H. El-houari, S. Smouh, A. Allouhi, Â. Frimane, S. I. Kaitouni, S. Oubenmoh, F. Mansouri, Aggour Mohammed, M. El Ydrissi, A. Jamil, Abdel Ali Mana, Mohamed Oualid Mghazli, Niima Es-sakali, Samir El idrissi kaitouni, Rachid El mrabet, Mohamed Ahachad"
A. Jamil,"T. Kousksou, A. Allouhi, Y. Zeraouli, T. E. Rhafiki, T. Bouhal, Y. Agrouaz, A. Benbassou, S. Fertahi, R. Saadani, R. Saidur, M. Buker, J. Dumas, M. B. Amine, H. El-houari, A. Arid, F. Gargab, M. Mahdaoui, A. A. Msaad, Y. Mourad, M. Rahmoune"
Ali Lamrani Alaoui,"A. Amrani, Jamal-Eddine Salhi, Abdelkarim Daoudia, Ahmed Alami Merrouni, Y. El hassouani, E. Chaabelasri, Mohammed Halimi, N. Salhi, Seyed Soheil Mousavi Ajarostaghi, M. Halimi, Salah-eddine Amrani, Ouafae Boulerhcha, Ahmed Alami Merouni, Mohsen Saffari Pour, Sofian Talbi, M. Salhi"
A. Amrani,"Y. El hassouani, A. A. Merrouni, Samir Touili, Ahmed Alami Merrouni, Jamal-Eddine Salhi, A. Mezrhab, E. Chaabelasri, Abdelkarim Daoudia, Ali Lamrani Alaoui, S. Amraqui, N. Dihmani, Y. Hassouani, A. Azouzoute, M. Djafari Rouhani, N. Salhi, Nassreddine Hmidi, Ali Lamrani Alaoui, Ouafae Boulerhcha, Mohammed Halimi, A. El Amrani"
Y. El hassouani,"A. Amrani, Ahmed Alami Merrouni, Samir Touili, E. E. El Boudouti, Abdelkarim Daoudia, B. Djafari-Rouhani, Ali Lamrani Alaoui, S. Ziani, V. Velasco, Jamal-Eddine Salhi, J. Vasseur, Samir Bouhiyadi, Hafid Ben Achour, Youssef Chaou, Mohammed Halimi, H. Aynaou, E. Chaabelasri, A. A. Merrouni, A. Azouzoute, L. Souinida"
Ghizlane Benezzine,"Koulali Yahya, Abdeljallil Zouhri, Yahiya Koulali, A. Zouhri, Y. Koulali, Zouhri Abdeljalil"
Abdeljallil Zouhri,"Ghizlane Benezzine, Yahiya Koulali"
Yahiya Koulali,"Ghizlane Benezzine, Abdeljallil Zouhri"
Chakib El Mokhi,"A. Addaim, H. Hachimi, Ahmed Ait Errouhi, Oumaima Choukai, Abderrahim Lakhouit, Mohamed Kaicer, Jihad Satri, Ahmed Hamed, Hanaa Hachimi, Zakaria Oumimoun"
Oumaima Choukai,"D. Zejli, Ahmed Ait Errouhi, Chakib El Mokhi, Zakaria Oumimoun, S. Sayadi, Ahmed Hamed, Y. Ezaier, Mohammad Yusuf, Salman A. Alqahtani, Oumaima Ait Omar, Nour Eddine El Fezazi, Mustapha Tahaikt, Azzeddine El Midaoui, Dounia Bellar, Manish Gupta, Muhammad Ijaz Khan, A. Ouammi, H. El Fadil, H. Hachimi"
Ahmed Ait Errouhi,"Oumaima Choukai, Chakib El Mokhi, Zakaria Oumimoun, Ahmed Hamed, Oumaima Ait Omar, Nour Eddine El Fezazi, H. El Fadil, H. Hachimi"
M. Taher,"I. Etebaai, Abdelhak Bourjila, Ali Errahmouni, H. El Talibi, F. Dimane, Omar Saadi, N. Nouayti, S. El Moussaoui, Yahya El Hammoudani, Hossain El Ouarghi, Hinde Cherkaoui Dekkaki, Mustapha Lamgharbaj, Touafik Mourabit, Bourjila Abdelhak, Abdelghafour Hrida, Abdelhamid Tawfik, Soukaina Ed-Dakiri, T. Mourabit, Najat Amarjouf, Afaf Amine"
Touafik Mourabit,"Abdelhak Bourjila, Ali Errahmouni, M. Taher, Omar Saadi, H. El Talibi, Mhamed El Mousaoui, Fouad El Marzkioui, Mastapha Lamgharbaj, I. Etebaai"
Mhamed El Mousaoui,"Sara Benabdelouahab, A. Casas Ponsati, Adil Salhi, T. Benabdelouahab, M. Himi, Omar Saadi, J. Martín-Vide, Abdelkarim El Morabit, A. Okacha, Yassin El Hasnaoui, Abdelhak Bourjila, Ihsan Larifi, Noeman Acharrat, El Ouazna Bouayad, Ali Errahmouni, Fouad El Marzkioui, Touafik Mourabit, M. Taher, A. Boudhar, Y. Lebrini"
Boulakhbar Mouaad,"Markos Farag, Benabdelaziz Kawtar, Khaldi Hamza, Zazi Malika, Kousksou Tarik, Mounir Hamid"
Markos Farag,"M. Boulakhbar, T. Kousksou, Kawtar Benabdelaziz, Chahir Zaki, M. Zazi, Ephraim A Ogbonna, M. Maaroufi, Boulakhbar Mouaad, Benabdelaziz Kawtar, Olalekan J. Akintande, Olusanya E. Olubusoye, Zazi Malika, Kousksou Tarik, O. Yaya"
Zazi Malika,"M. Mohamed, Wira Patrice, M. Sami, Zazi Khalida, Chorfi Jawad, Chtouki Ihssane, colicchio Bruno, Markos Farag, Boulakhbar Mouaad, Benabdelaziz Kawtar, Kousksou Tarik, Rayyam Marouane"
Khalid Echlouchi,"Mustapha Ouardouz, A. Bernoussi, H. Boulaassal, A. Bernoussi"
Mustapha Ouardouz,"A. Bernoussi, M. Amharref, B. Benamrou, Mohamed Byari, I. Allaouzi, A. Bernoussi, M. Ben ahmed, Iliasse Abdennour, Khalid Echlouchi, O. Jellouli, H. Kassogué, M. Kharbach, M. Ahmed, Tarik Elamrani, A. Boudhir, Mohammed Abattouy, Samir Allach, Bel Fekih, M. Ammari, M. E. Hankouri"
A. Bernoussi,"M. Amharref, Mustapha Ouardouz, Hind Es Saouini, R. Bouchnan, P. Frison, Mohamed Byari, Tarik Elamrani, Siham Acharki, Hind Es Saouini, Sarah El Azizi, Hind Essaouini, Fouad Bekkour, Iliasse Abdennour, Y. Arjdal, B. Abdelaziz, Elbaraka Yassine, Fadoua El Qorchi, Laila Knitar, Abdellah Trankil, Bijeesh Kozhikkodan Veettil"
M. Taher,"I. Etebaai, Abdelhak Bourjila, Ali Errahmouni, H. El Talibi, F. Dimane, Omar Saadi, N. Nouayti, S. El Moussaoui, Yahya El Hammoudani, Hossain El Ouarghi, Hinde Cherkaoui Dekkaki, Mustapha Lamgharbaj, Touafik Mourabit, Bourjila Abdelhak, Abdelghafour Hrida, Abdelhamid Tawfik, Soukaina Ed-Dakiri, T. Mourabit, Najat Amarjouf, Afaf Amine"
Touafik Mourabit,"Abdelhak Bourjila, Ali Errahmouni, M. Taher, Omar Saadi, H. El Talibi, Mhamed El Mousaoui, Fouad El Marzkioui, Mastapha Lamgharbaj, I. Etebaai"
Mhamed El Mousaoui,"Sara Benabdelouahab, A. Casas Ponsati, Adil Salhi, T. Benabdelouahab, M. Himi, Omar Saadi, J. Martín-Vide, Abdelkarim El Morabit, A. Okacha, Yassin El Hasnaoui, Abdelhak Bourjila, Ihsan Larifi, Noeman Acharrat, El Ouazna Bouayad, Ali Errahmouni, Fouad El Marzkioui, Touafik Mourabit, M. Taher, A. Boudhar, Y. Lebrini"
Y. Almulla,"M. Howells, C. Ramirez, F. Gardumi, A. Shivakumar, Constantinos Taliotis, Vignesh Sridharan, E. Ramos, A. Lipponen, Eduardo Zepeda, C. Arderne, C. Sundin, A. Huber-Lee, Francesco Fuso-Nerini, B. Joyce, L. de Strasser, M. Weinstein, Will Usher, F. F. Nerini, G. Balderrama, A. Beltramo"
C. Ramirez,"Y. Almulla, A. Huber-Lee, B. Joyce, F. Fuso Nerini, M. Howells, A. Lipponen, I. Pappis, R. Engström, L. D. Strasser, C. Sundin, Babak Khavari, Silvia Ulloa, J. Quirós-Tortós, Jam Angulo-Paniagua, Francesco Fuso-Nerini, E. Ramos, Constantinos Taliotis, L. de Strasser, Konstantinos Pegios, M. Jeuland"
Francesco Fuso-Nerini,"Hamidreza Eivazi, Robyn A. Haggis, Lena I. Fuldauer, Y. Almulla, M. Howells, Ricardo Vinuesa, R. Nicholls, Emelie Rosenberg, J. Hall, S. Thacker, F. Mallor, R. Engström, C. Sundin, Anna Felländer, F. Jaramillo, Manuela Battaglini, A. Huber-Lee, D. Pastor-Escuredo, B. Joyce, C. Ramirez"
Mounir Abraim,"H. Ghennioui, A. Ghennioui, Omaima El Alani, A. Azouzoute, M. El Ydrissi, N. Hanrieder, Mohamed Boujoudar, S. Wilbert, Massaab El Ydrissi, Omaima El Alani, Azouzoute Alae, Y. Saint-Drenan, Ayoub Oufadel, Fatima-ezzahra Dahr, Mustapha Salihi, Hicham El Gallassi, Ilyass Ikenbi, Ibrahim Taabane, P. Blanc, E. Bennouna"
Hicham El Gallassi,"A. Ghennioui, Ahmed Alami Merrouni, M. Chourak, Maryam Mehdi, Nabil Ammari, Omaima El Alani, M. Dahmani, J. Aguilar, Mounir Abraim, H. Ghennioui, Ricardo Conceição, S. Wilbert, N. Hanrieder"
S. Wilbert,"L. Zarzalejo, B. Nouri, R. Pitz‐Paal, N. Hanrieder, P. Blanc, Pascal Kuhn, L. Ramírez, A. Kazantzidis, F. Wolfertstetter, C. Prahl, N. Geuder, M. Sengupta, M. Schroedter-Homscheidt, C. Gueymard, F. Vignola, A. Habte, J. Polo, R. Affolter, T. Hirsch, T. Schmidt"
Abderrahim Benallel,"Amine Tilioua, Abdellah Mellaikhafi, Mohamed Ouakarrouch, Moulay Ahmed Alaoui Hamdi, Abdelhak Babaoui, Mohammed Garoum, M. Garoum, M. Ettakni, M. Garoum, Said Bousshine, Moulay Ahmed Alaoui Hamdi, Moulay Ahmed Alaoui Hamdi, Abdellah Mellaikhafia, Maryam Dlimi, N. Laaroussi, A. Bybi"
Amine Tilioua,"Abderrahim Benallel, Abdellah Mellaikhafi, Ibtissam Lamaamar, Mohamed Ouakarrouch, Moulay Ahmed Alaoui Hamdi, Abdelhak Babaoui, M. A. Hamdi Alaoui, M. Garoum, Zaineb Ben Zaid, Omar Ansari, Mohamed Hajjaj, M. Ettakni, H. Souli, Said Bousshine, Zaineb Benzaid, Youssef Boutahri, Mohammed Garoum, N. Laaroussi, C. Messaoudi, A. Bybi"
Moulay Ahmed Alaoui Hamdi,"Amine Tilioua, Abdellah Mellaikhafi, Abderrahim Benallel, Abdelhak Babaoui, H. Souli, Mohammed Garoum, Abdellah Mellaikhafia, M. Garoum"
N. Abdou,"T. Mohammaden, M. Badran, Y. E. Mghouchi, S. Hamdaoui, H. Yakoubi, N. E. Asri, A. Hajou, M. Mouqallid, A. Khellouki"
Y. E. Mghouchi,"T. Ajzoul, A. Bouardi, E. Chham, N. Abdou, Z. Choulli, Hasan Yıldızhan, M. Udriștioiu, S. Hamdaoui, A. Milena-Pérez, K. Benaalilou, B. E. Bakkari, Y. Boulaich, M. Chaoui, H. Yakoubi, N. E. Asri, Anas Hajou, A. Hajou, M. Krikiz, D. Taoukil, J. Qiao"
M. Mouqallid,"H. Majdoubi, A. Senhaji, Fida Zair, H. Fatnassi, E. Chatri, A. Bekraoui, Sanae Chakir, M. Mahdaoui, A. A. Msaad, T. Boulard, L. Bouirden, H. Demrati, E. Affad, Salma Elbahi, S. Hamdaoui, N. Abdou, Y. E. Fellah, R. Errais, N. E. Asri, El Chatri Houssine"
