Author,Co-authors
Khalid Benjmel,"F. Amraoui, A. Tahiri, M. Abioui, M. Sinan, M. Ouchchen, Anas Driouch, S. Boutaleb, L. Ouadif, E. Talbi, S. Ilmen, Mohamed Bhilisse, D. E. Azzab, I. Antunes, F. Z. Echogdali, K. Mickus, B. Pradhan, F. Berrada, Amine Touab, Abdessamad Hadri, Mohamed Abdellah Ezzaouini"
F. Amraoui,"L. Vogt, B. H. van den Born, G. Afink, A. Tahiri, Khalid Benjmel, N. Chakri, Undine Giseke, Mohemed Chlaida, Mohamed Mdafai, Frank Helten, A. Adidi, S. Berdouz, C. Ris-Stalpers, M. Gerster-Bentaya, Majid Mansour, Guido Spars, L. Spijkers, D. Scherer, M. Kraume, S. Peters"
Amine Touab,"S. Danni, Mohammed Hssaisoune, H. Schreiber, Yassine Ez-zaouy, L. Bouchaou, N. Montcoudiol, M. Ouchchen, F. Amraoui, A. Tahiri, Khalid Benjmel, Fatima Abourig, Fatima Abourrig, U. Kalberkamp, S. Boutaleb"
S. Oubenmoh,"R. Saadani, M. Rahmoune, M. El Alami, Afaf Charraou, Amina Mourid, S. Hamdaoui, A. Ait Mssad, E. H. Sebbar, A. Allouhi, M. Bentaleb, A. Bouyahyaoui, A. Jamil, B. Ouaki, F. Gargab, Khalid Ibaaz, M. El Ydrissi, A. Jamil, Khadija Annaba, A. A. Mssad, Y. El Afou"
A. Allouhi,"A. Jamil, T. Kousksou, Y. Zeraouli, T. E. Rhafiki, M. Buker, R. Saidur, M. B. Amine, A. Jamil, Y. Mourad, Y. Chaibi, R. Saadani, A. Benbassou, S. Rehman, H. El-houari, M. Mahdaoui, A. Boharb, M. Rahmoune, K. Lahrech, Y. Agrouaz, A. A. Msaad"
M. Bentaleb,"N. Schulz, E. Lubkiewicz, W. Phillips, B. Varley, L. Morss, I. Ahmad, J. Durell, W. Urban, A. Smith, M. Leddy, C. T. Zhang, P. Bhattacharyya, P. J. Daly, J. Blomqvist, Z. Grabowski, C. Pearson, J. Shannon, B. Fakrach, H. Chadli, T. Rząca-Urban"
Touria Haidi,"Abdelaziz Belfqih, Jamal Boukherouaa, Bouchra Cheddadi, Faissal Elmariami, Meriem Majdoub, Omar Sabri, Z. E. Idrissi, Doha Bouabdallaoui, Mariam El jaadi, Ali Tarraq, F. E. Mariami, E. Mellouli, F. El Mariami, Mounir Derri, Abderrahmane Janyene, Abdelouhid El-Jalyly, M. Fikri, Ali Tarrak, Zineb Lakhlifi El Idrissi, Naima Agouzoul"
Bouchra Cheddadi,"Omar Sabri, M. Fikri, Meriem Majdoub, Abdelaziz Belfqih, Touria Haidi, Jamal Boukherouaa, F. E. Mariami, R. Aboulaich, Ali Tarrak, Z. E. Idrissi, Belfqih Abdelaziz, Nazha Cherkaoui, A. Cheddadi, Tonria Haidi"
Ali Tarrak,"Z. E. Idrissi, F. E. Mariami, Touria Haidi, Bouchra Cheddadi"
Omayma Amellah,"Karim Elmorabiti, M. Al-Djazouli, Karim el Morabiti, A. Rahimi, Omer Abdelrahim Mohammed Fadil, Mahamat Ouchar Al-djazouli, Ali Bounab, C. Maftei, Constantine Papatheodorou, B. Zoheir, C. Buta"
Karim el Morabiti,"Omayma Amellah, Mahamat Ouchar Al-djazouli, Ali Bounab, C. Maftei, Constantine Papatheodorou, C. Buta"
